{
  "corpora": [
    {
      "canonical_manifest_sha256": "0983d6e6613f03a102cf3727c98477d4d3df0fd5e2864bcc5934c547f0bc8cb6",
      "case_id": "case-0960k",
      "corpus_ref": "protected://benchmark-long-context-v2/evidence-sources/case-0960k",
      "document_count": 59,
      "document_inventory_sha256": "15f6af1a50070f35181baebbe97e2e97aa62ce757e2e18e3f9207dfa5eedf652",
      "payload_sha256": "ee60917ba35f6aff06e313a7460f22b997e25f67c93b3a96d5821243a0ad2aa8",
      "process_metadata_ref": {
        "ref": "protected://benchmark-long-context-v2/corpora/case-0960k/process-metadata.json",
        "sha256": "7aa6a9dad334b707a4b2c65eae97e91d79d64b3809ec211fa6dc32830a116593"
      },
      "runtime_bundle_inventory_sha256": "5fae67873d0d40bf6cccbcd874e4b3944f9bbd752b75c0a1861db824acb5ed38",
      "token_count": 960682,
      "token_count_semantics": "tiktoken_o200k_base_full_payload_serialization"
    },
    {
      "canonical_manifest_sha256": "eef63f9a7127ff9417b5f0c24a409f4e195247469f07b215e8c9badc9848eeae",
      "case_id": "case-5120k",
      "corpus_ref": "protected://benchmark-long-context-v2/evidence-sources/case-5120k",
      "document_count": 331,
      "document_inventory_sha256": "d82a497ac3d7a28cf14739864d00c970c5ba1c6b15ed41397694f145989533b0",
      "payload_sha256": "7cb1ba5480b317ba52d4fedfccf19f175c06713c6eb8b2450f4c3aa04b163bb4",
      "process_metadata_ref": {
        "ref": "protected://benchmark-long-context-v2/corpora/case-5120k/process-metadata.json",
        "sha256": "527658759b0e05e1a1584d5a1598f7cec3802dcd61c906fe6550e96c04534c07"
      },
      "runtime_bundle_inventory_sha256": "3986f4d15cef9b05345d23a531624ba77a0c6b086c67e99ede170af342ee0a64",
      "token_count": 5120866,
      "token_count_semantics": "tiktoken_o200k_base_full_payload_serialization"
    },
    {
      "canonical_manifest_sha256": "43665a6faabb1bb5403cd84d285378531baeffd333f92e388c4cd2e806cdd101",
      "case_id": "case-6260k",
      "corpus_ref": "protected://benchmark-long-context-v2/evidence-sources/case-6260k",
      "document_count": 61,
      "document_inventory_sha256": "3a36c4407c07222159afb20a0e554e6170ba752320e917ad351d2f83df05a279",
      "payload_sha256": "47f25dcc091a4f3bc1be9f8d82b6320b82048ce50eec05269cd945545af2dfb5",
      "process_metadata_ref": {
        "ref": "protected://benchmark-long-context-v2/corpora/case-6260k/process-metadata.json",
        "sha256": "d8aa1ce0e1db782a0c82172f7c12014d69f96473490927da37871f0da88f7bb2"
      },
      "runtime_bundle_inventory_sha256": "c70a2d4bd6f75c5792d15f872e56c4d95d4c4afeaeab0111f4d2066795747e85",
      "token_count": 6260548,
      "token_count_semantics": "tiktoken_o200k_base_full_payload_serialization"
    }
  ],
  "dataset_name": "benchmark-long-context",
  "description": "Campanha long-context v2: manifesto reproduzível com conteúdo protegido resolvido apenas em runtime.",
  "evaluation_contract": {
    "ref": "dataset/long-context/benchmark-long-context-v2-evaluation-contract.json",
    "sha256": "ed0bfcda426f906302ddb9c4402fa9625acf045d80c4c4f15c7d73214f5e8761"
  },
  "items": [
    {
      "absence_evidence": {
        "ref": null,
        "required": false,
        "scope": "not_applicable"
      },
      "case_id": "case-0960k",
      "evidence": {
        "allowed": [
          "exact_opened_excerpts",
          "document_metadata",
          "explicit_protected_absence"
        ],
        "forbidden": [
          "judge_world_knowledge",
          "question_only",
          "gold_only",
          "unopened_document"
        ],
        "source_refs": [
          {
            "ref": "protected://benchmark-long-context-v2/items/case-0960k-q1-factual/evidence-1.json",
            "sha256": "9f6d243203f40f3e313f699a1693dd68fe3c173f395f87666672d1f25d2436bb"
          }
        ]
      },
      "gold": {
        "ref": "protected://benchmark-long-context-v2/items/case-0960k-q1-factual/gold.txt",
        "sha256": "39a09c56bc099551be232e02f14ae68d3a3c2d83a27ab103df8f9dde7ce83fbb"
      },
      "item_id": "case-0960k-q1-factual",
      "question": {
        "ref": "protected://benchmark-long-context-v2/items/case-0960k-q1-factual/question.txt",
        "sha256": "4419405b009f8b4697a10dfd4cb5878e763ffad8a5f36ba9746ae594e3bbf988"
      },
      "question_type": "factual",
      "rubric": {
        "ref": "protected://benchmark-long-context-v2/items/case-0960k-q1-factual/rubric.json",
        "sha256": "3093dc88dbbdae303e963d4e9db280c6c2003b1ee69da29e387a2693a05569a7"
      },
      "target": {
        "anchor_kind": "unique_regulatory_obligation",
        "anchor_ref": {
          "ref": "protected://benchmark-long-context-v2/items/case-0960k-q1-factual/target-anchor.json",
          "sha256": "949212186adcee42af2c2261ab14213899bb217c0e3c0fc8de3169d497db0ec7"
        },
        "lock_required": true
      }
    },
    {
      "absence_evidence": {
        "ref": null,
        "required": false,
        "scope": "not_applicable"
      },
      "case_id": "case-0960k",
      "evidence": {
        "allowed": [
          "exact_opened_excerpts",
          "document_metadata",
          "explicit_protected_absence"
        ],
        "forbidden": [
          "judge_world_knowledge",
          "question_only",
          "gold_only",
          "unopened_document"
        ],
        "source_refs": [
          {
            "ref": "protected://benchmark-long-context-v2/items/case-0960k-q2-synthesis/evidence-1.json",
            "sha256": "24692885a928c6b6a6142cde07f51ec3df11b85866ffcd7db575af8a59852175"
          },
          {
            "ref": "protected://benchmark-long-context-v2/items/case-0960k-q2-synthesis/evidence-2.json",
            "sha256": "3bd6e6493d215ed8310f227ddf1faf644f6902031f559a5ef82c658e7d56fbda"
          }
        ]
      },
      "gold": {
        "ref": "protected://benchmark-long-context-v2/items/case-0960k-q2-synthesis/gold.txt",
        "sha256": "3af21ac3bba2bb5cd90a2e9c1572e7fb5ff4474a74f08f67489b7bd21265b745"
      },
      "item_id": "case-0960k-q2-synthesis",
      "question": {
        "ref": "protected://benchmark-long-context-v2/items/case-0960k-q2-synthesis/question.txt",
        "sha256": "df01c3aed7a08e962c2473af90df67796cf6b6ea16b5fcfb65a0a1f0c8a59f7f"
      },
      "question_type": "synthesis",
      "rubric": {
        "ref": "protected://benchmark-long-context-v2/items/case-0960k-q2-synthesis/rubric.json",
        "sha256": "199363efc08ef5ff339b775b572089591b66597be8b7522065a5c4b1fd7db40a"
      },
      "target": {
        "anchor_kind": "official_document_pair",
        "anchor_ref": {
          "ref": "protected://benchmark-long-context-v2/items/case-0960k-q2-synthesis/target-anchor.json",
          "sha256": "b3696c3f05763bc1eaf915fdcdff073dddbcfe3e3f7440065677c37788168a59"
        },
        "lock_required": true
      }
    },
    {
      "absence_evidence": {
        "ref": {
          "ref": "protected://benchmark-long-context-v2/items/case-0960k-q3-insufficient-evidence/absence-evidence.json",
          "sha256": "35fdf67e2f2fd7a8473ef3ef1d0afcda2141e34cd3f144b2dfe67ca222b7be3c"
        },
        "required": true,
        "scope": "protected_lexical_search_only"
      },
      "case_id": "case-0960k",
      "evidence": {
        "allowed": [
          "exact_opened_excerpts",
          "document_metadata",
          "explicit_protected_absence"
        ],
        "forbidden": [
          "judge_world_knowledge",
          "question_only",
          "gold_only",
          "unopened_document"
        ],
        "source_refs": []
      },
      "gold": {
        "ref": "protected://benchmark-long-context-v2/items/case-0960k-q3-insufficient-evidence/gold.txt",
        "sha256": "88195119935db89cf2ad8ee3f17483a83e7f50fccc46a819c11d6e8d58c96836"
      },
      "item_id": "case-0960k-q3-insufficient-evidence",
      "question": {
        "ref": "protected://benchmark-long-context-v2/items/case-0960k-q3-insufficient-evidence/question.txt",
        "sha256": "f22de7c67bf944041ed1bc5154c264330c6e7899882904afdd6dd77c067344d7"
      },
      "question_type": "insufficient-evidence",
      "rubric": {
        "ref": "protected://benchmark-long-context-v2/items/case-0960k-q3-insufficient-evidence/rubric.json",
        "sha256": "601e0f942a81ce1cc9b68bcd184977e47cb2a88af989c29fe2cd3f7657ddd367"
      },
      "target": {
        "anchor_kind": "corpus_wide_period_scope",
        "anchor_ref": {
          "ref": "protected://benchmark-long-context-v2/items/case-0960k-q3-insufficient-evidence/target-anchor.json",
          "sha256": "490a0f62aa0415f60a9c10d98b9cd47609e8330f5bea1cb16ae4070fcc58cc3c"
        },
        "lock_required": true
      }
    },
    {
      "absence_evidence": {
        "ref": null,
        "required": false,
        "scope": "not_applicable"
      },
      "case_id": "case-5120k",
      "evidence": {
        "allowed": [
          "exact_opened_excerpts",
          "document_metadata",
          "explicit_protected_absence"
        ],
        "forbidden": [
          "judge_world_knowledge",
          "question_only",
          "gold_only",
          "unopened_document"
        ],
        "source_refs": [
          {
            "ref": "protected://benchmark-long-context-v2/items/case-5120k-q1-factual/evidence-1.json",
            "sha256": "ee2c0e5713d5c60f18d76b904d16cf35a576d62ed5e872b4acf94f94efa00321"
          }
        ]
      },
      "gold": {
        "ref": "protected://benchmark-long-context-v2/items/case-5120k-q1-factual/gold.txt",
        "sha256": "d58d542091e716b0071c47face1f40a495c35fd6755afb90eac3380994649568"
      },
      "item_id": "case-5120k-q1-factual",
      "question": {
        "ref": "protected://benchmark-long-context-v2/items/case-5120k-q1-factual/question.txt",
        "sha256": "4fa2e2d9c3b422dd7eb64c7a5330fd31cb88e24a128899560a72011c9535bc34"
      },
      "question_type": "factual",
      "rubric": {